{
  "version": "v0.7.0",
  "generated": "2026-07-23T19:22:00Z",
  "notes": [
    "Public test vectors for interoperability testing only. Never use these mnemonic words, coefficients, Session Batch IDs, MAT keys, or DRKs for real funds.",
    "This v0.7.0 set replaces the live v0.6.0 vectors. Historical vectors must be read from previous_versions/."
  ],
  "vectors": [
    {
      "id": "tv-v0.7.0-gf2053-2of3-12w-full-compact",
      "type": "arithmetic-and-payload",
      "description": "GF(2053) 2-of-3, 12-word BIP39 vector covering v0.7.0 arithmetic, Full Payloads, Compact Payloads, RBT, Transport Hash, Manifest Audit Hash, and recovery.",
      "params": {
        "field_prime": 2053,
        "threshold": { "k": 2, "n": 3 },
        "share_indices": [1, 2, 3],
        "word_count": 12,
        "row_count": 4,
        "bip39_language": "en",
        "language_input_byte_hex": "01",
        "output_profiles": ["full", "compact"],
        "column_tags": [100, 200, 300],
        "row_total": 10,
        "column_total": 600,
        "flags_hex": "28",
        "protocol_version_hex": "01"
      },
      "mnemonic": {
        "words": ["spin", "result", "brand", "ahead", "poet", "carpet", "unusual", "chronic", "denial", "festival", "toy", "autumn"],
        "indices_1_based": [1680, 1471, 217, 42, 1338, 279, 1907, 324, 468, 682, 1844, 126]
      },
      "coefficients": [1, 2052, 1126, 2012, 710, 571, 146, 1728, 2000, 130, 122, 383],
      "base_values": {
        "row_checksums": [1316, 1661, 649, 603],
        "column_checksums": [305, 1071, 1390],
        "base_gic": 723
      },
      "rbt": {
        "canonical_secret_material_hex": "016905BF0D902A53A1177731441D42AA73407E",
        "kdf": "PBKDF2-HMAC-SHA512",
        "iterations": 16384,
        "full_session_batch_id_hex": "A1B2C3D4E5F60708",
        "compact_session_batch_id_hex": "0A1B2C3D",
        "full_rbt_hex": "3DE50771B03A018838A0D18E",
        "compact_rbt_hex": "D9A9E72E3568"
      },
      "shares": [
        {
          "x": 1,
          "word_values": [1681, 1470, 1343, 1, 2048, 850, 0, 2052, 415, 812, 1966, 509],
          "row_checksums": [389, 848, 417, 1238],
          "column_checksums": [541, 1577, 1364],
          "printed_gic": 1440,
          "full_payload": {
            "share_data_hex": "6915BE53F00180035200080419F32C7AE1FD1853501A14D621D6295545A0",
            "transport_hash_hex": "A9815442E1C5ED59F685D71611C15CAC",
            "payload_hex": "534601280102000100A1B2C3D4E5F607083DE50771B03A018838A0D18E6915BE53F00180035200080419F32C7AE1FD1853501A14D621D6295545A0A9815442E1C5ED59F685D71611C15CAC",
            "payload_len": 75,
            "manifest_audit_hash_hex": "698D7209F3E5521C0EB054E8B44B0AE9252E8FE38F32C41BD48F6DF5A658F917"
          },
          "compact_payload": {
            "share_data_hex": "6915BE53F00180035200080419F32C7AE1FD",
            "payload_hex": "534301280102010A1B2C3DD9A9E72E35686915BE53F00180035200080419F32C7AE1FD",
            "payload_len": 35,
            "manifest_audit_hash_hex": "AEFBB13028461385620DF5D0BA941589BB7ED402F8C76DDF9B957A6AFA51AD3A"
          }
        },
        {
          "x": 2,
          "word_values": [1682, 1469, 416, 2013, 705, 1421, 146, 1727, 362, 942, 35, 892],
          "row_checksums": [1515, 35, 185, 1873],
          "column_checksums": [777, 30, 1338],
          "printed_gic": 104,
          "full_payload": {
            "share_data_hex": "6925BD1A07DD2C158D0926BF16A3AE02337C5EB0230B975130901E53A068",
            "transport_hash_hex": "3B3E1825BBBFE4EB122AD74D405CA3F8",
            "payload_hex": "534601280102000200A1B2C3D4E5F607083DE50771B03A018838A0D18E6925BD1A07DD2C158D0926BF16A3AE02337C5EB0230B975130901E53A0683B3E1825BBBFE4EB122AD74D405CA3F8",
            "payload_len": 75,
            "manifest_audit_hash_hex": "A2F949C72E7C0681A3B44715016026B0428450A1C00544A4555A234D56F89ADB"
          },
          "compact_payload": {
            "share_data_hex": "6925BD1A07DD2C158D0926BF16A3AE02337C",
            "payload_hex": "534301280102020A1B2C3DD9A9E72E35686925BD1A07DD2C158D0926BF16A3AE02337C",
            "payload_len": 35,
            "manifest_audit_hash_hex": "908AD30DDBF9E6CA196BC4F01A683D4970EEC2823BBF155CD6B059249DC77F57"
          }
        },
        {
          "x": 3,
          "word_values": [1683, 1468, 1542, 1972, 1415, 1992, 292, 1402, 309, 1072, 157, 1275],
          "row_checksums": [588, 1275, 2006, 455],
          "column_checksums": [1013, 536, 1312],
          "printed_gic": 821,
          "full_payload": {
            "share_data_hex": "6935BC6067B45877C812457A13543009D4FB24C4FB7D61C73F5218520335",
            "transport_hash_hex": "BB20C37BBA6BE2C7E75FED4BB2E901E7",
            "payload_hex": "534601280102000300A1B2C3D4E5F607083DE50771B03A018838A0D18E6935BC6067B45877C812457A13543009D4FB24C4FB7D61C73F5218520335BB20C37BBA6BE2C7E75FED4BB2E901E7",
            "payload_len": 75,
            "manifest_audit_hash_hex": "3F8E8F27537DC85D91B371F6289382F890E5AF43D3E11A1335F69F8A5D701FE1"
          },
          "compact_payload": {
            "share_data_hex": "6935BC6067B45877C812457A13543009D4FB",
            "payload_hex": "534301280102030A1B2C3DD9A9E72E35686935BC6067B45877C812457A13543009D4FB",
            "payload_len": 35,
            "manifest_audit_hash_hex": "3491EEBC80B78401CFEA7B40505BFE578B9D41D183FB2164AE8A35E18D0AAE2C"
          }
        }
      ],
      "recovery": {
        "shares_used": [1, 2],
        "lagrange_coefficients": [2, 2052],
        "lagrange_sanity": 0,
        "recovered_word_indices": [1680, 1471, 217, 42, 1338, 279, 1907, 324, 468, 682, 1844, 126],
        "recovered_row_checksums": [1316, 1661, 649, 603],
        "recovered_column_checksums": [305, 1071, 1390],
        "recovered_base_gic": 723
      }
    },
    {
      "id": "tv-v0.7.0-mat-share1-dual",
      "type": "mat",
      "description": "Deterministic dual-MAT example for Share 1 of the 12-word 2-of-3 vector.",
      "source_vector": "tv-v0.7.0-gf2053-2of3-12w-full-compact",
      "share_index": 1,
      "row_values": [
        [1681, 1470, 1343],
        [1, 2048, 850],
        [0, 2052, 415],
        [812, 1966, 509]
      ],
      "mat_columns": [
        {
          "column": 1,
          "weights": [2, 4, 7],
          "row_pads": [6, 8, 10, 12],
          "tags": [172, 1834, 858, 745]
        },
        {
          "column": 2,
          "weights": [11, 13, 17],
          "row_pads": [19, 23, 29, 31],
          "tags": [914, 48, 912, 61]
        }
      ]
    }
  ]
}
